id_utilisateur,nom_album,date_upload,duree,type_album
129,quis odio consequat varius integer,1926-06-10,0:40:54,Album
964,non sodales sed tincidunt eu felis fusce posuere felis sed,1959-03-19,0:35:26,Album
173,felis eu sapien cursus vestibulum proin eu mi,1907-03-01,0:52:02,Single
618,aenean fermentum donec ut mauris eget,1958-12-10,0:49:25,Mixtape
618,potenti cras in purus eu magna vulputate,1939-12-24,0:03:17,Single
458,tortor quis turpis sed ante vivamus tortor duis mattis,1979-08-18,0:21:29,Compilation
979,id luctus nec molestie sed justo pellentesque viverra pede ac,2013-10-06,0:25:30,Mixtape
708,sagittis nam congue risus semper porta volutpat quam,1909-03-26,0:55:16,Compilation
653,in purus eu magna vulputate luctus cum,1997-02-14,0:10:31,Mixtape
553,pede malesuada in imperdiet et commodo vulputate justo in blandit,2006-09-26,0:26:59,Compilation
653,et magnis dis parturient montes nascetur ridiculus,1941-12-20,0:28:49,Single