id_utilisateur,nom_album,date_upload,duree,type_album
694,sapien iaculis congue vivamus metus arcu adipiscing molestie hendrerit at,1913-05-28,0:26:12,Mixtape
63,quis odio consequat varius integer ac leo pellentesque ultrices,1946-12-17,0:44:27,EP
503,in felis eu sapien cursus vestibulum proin eu mi nulla,2000-02-08,0:54:49,Single
313,ac est lacinia nisi venenatis tristique fusce congue diam,1966-03-10,0:59:04,Mixtape
24,hac habitasse platea dictumst aliquam augue quam sollicitudin vitae consectetuer,1933-04-30,0:43:36,Single
768,lacinia nisi venenatis tristique fusce congue,1964-10-28,0:13:26,Compilation
664,semper porta volutpat quam pede lobortis ligula sit amet eleifend,2004-10-05,0:26:30,EP
283,ut tellus nulla ut erat,2008-08-29,0:18:45,Single
314,lacus morbi sem mauris laoreet ut rhoncus aliquet pulvinar,1975-06-04,0:20:08,EP
588,suspendisse ornare consequat lectus in est risus auctor sed,1964-01-10,0:29:08,EP
694,eu nibh quisque id justo sit,2003-04-22,0:27:29,Mixtape
639,ligula vehicula consequat morbi a ipsum integer a,2014-08-24,0:26:09,Album
888,sapien dignissim vestibulum vestibulum ante ipsum primis in faucibus,1979-01-26,0:15:10,Album
334,vel enim sit amet nunc viverra,1962-11-20,0:41:47,Mixtape
818,at vulputate vitae nisl aenean,2001-01-02,0:49:13,Single
838,nulla mollis molestie lorem quisque ut erat curabitur gravida,1923-09-30,0:00:32,Compilation
723,ac tellus semper interdum mauris ullamcorper purus sit amet nulla,1929-07-25,0:00:38,Album
998,nullam varius nulla facilisi cras non velit,1944-01-03,0:18:41,Single
903,eu mi nulla ac enim in,2014-06-11,0:52:55,Single
359,morbi sem mauris laoreet ut rhoncus aliquet pulvinar,1949-02-02,0:18:19,Album
868,ut rhoncus aliquet pulvinar sed nisl nunc rhoncus,1967-06-01,0:24:15,Album
228,quam sollicitudin vitae consectetuer eget rutrum,2007-05-21,0:59:44,Album
718,lectus suspendisse potenti in eleifend quam a odio,1947-02-08,0:21:02,Mixtape
774,ridiculus mus vivamus vestibulum sagittis sapien cum,1972-08-16,0:26:47,EP
233,imperdiet nullam orci pede venenatis non,1918-09-19,0:52:08,Album
503,enim blandit mi in porttitor,1972-10-15,0:13:02,Album
888,consequat varius integer ac leo pellentesque ultrices mattis,1928-02-18,0:30:53,Mixtape
4,orci luctus et ultrices posuere,1967-09-27,0:14:39,Mixtape
404,vestibulum ante ipsum primis in faucibus orci luctus,1994-06-13,0:25:27,Compilation
78,integer tincidunt ante vel ipsum praesent blandit lacinia,1972-08-26,0:58:13,Compilation
914,odio justo sollicitudin ut suscipit a feugiat et,1988-06-18,0:29:44,EP
613,arcu sed augue aliquam erat volutpat,1962-11-17,0:51:16,Album
183,lectus in est risus auctor,2008-07-27,0:43:41,Mixtape
169,accumsan tortor quis turpis sed ante vivamus tortor duis,2016-02-11,0:05:45,EP
964,sed tristique in tempus sit,1902-07-01,0:17:03,Compilation
74,pede posuere nonummy integer non,1966-08-12,0:17:17,EP
494,sed vel enim sit amet nunc viverra dapibus,1946-06-06,0:39:19,Compilation
514,aliquam non mauris morbi non lectus,1911-05-13,0:40:01,EP
223,quis libero nullam sit amet,1921-10-08,0:05:54,Mixtape
143,ultrices posuere cubilia curae donec pharetra magna,1916-05-19,0:18:28,EP
758,augue a suscipit nulla elit ac nulla sed vel,1939-03-07,0:52:32,Album
658,justo aliquam quis turpis eget,1905-01-01,0:43:45,Compilation
464,dui vel sem sed sagittis nam congue,1952-01-01,0:24:50,Mixtape
978,ante nulla justo aliquam quis turpis,2001-12-10,0:49:26,Compilation
183,ac diam cras pellentesque volutpat,1992-04-11,0:56:38,EP
624,nisi eu orci mauris lacinia sapien quis libero nullam sit,1974-05-26,0:10:47,Compilation
404,elementum nullam varius nulla facilisi cras non velit nec,1922-06-15,0:06:21,Album
624,morbi odio odio elementum eu,1975-10-11,0:14:00,EP
809,urna pretium nisl ut volutpat,1986-12-27,0:50:06,EP
433,cursus urna ut tellus nulla ut erat id mauris,1959-10-12,0:40:26,Compilation
588,nibh in hac habitasse platea dictumst aliquam,1930-04-24,0:11:24,Mixtape
249,ac leo pellentesque ultrices mattis odio,2015-09-11,0:31:04,Album
993,in felis eu sapien cursus vestibulum proin,1979-04-17,0:48:48,Single
878,pretium iaculis diam erat fermentum justo,2017-06-17,0:04:13,EP
993,elementum nullam varius nulla facilisi cras non velit nec,1940-10-24,0:13:57,EP
813,justo morbi ut odio cras mi pede malesuada in,2017-10-23,0:26:56,Mixtape
78,ligula vehicula consequat morbi a ipsum integer a nibh in,1935-11-20,0:42:10,Compilation
649,porttitor pede justo eu massa,1909-01-12,0:23:49,Compilation
474,posuere cubilia curae donec pharetra magna vestibulum aliquet ultrices,2003-10-31,0:50:06,Compilation
679,integer non velit donec diam neque vestibulum eget vulputate,1931-03-03,0:30:23,Compilation
889,suspendisse potenti cras in purus eu magna,1967-09-25,0:26:36,EP
609,pellentesque at nulla suspendisse potenti cras in,2016-04-29,0:19:19,Compilation
124,lobortis sapien sapien non mi integer,1961-11-22,0:38:24,EP
969,posuere cubilia curae nulla dapibus,1979-03-26,0:01:23,Mixtape
773,iaculis justo in hac habitasse,1948-03-18,0:36:27,Mixtape
149,nunc proin at turpis a pede posuere nonummy integer non,2019-08-07,0:08:01,Single
429,nulla sed accumsan felis ut at dolor quis odio consequat,1933-07-18,0:25:54,Mixtape
854,magnis dis parturient montes nascetur ridiculus mus vivamus vestibulum sagittis,1949-08-13,0:20:22,Mixtape
674,cras mi pede malesuada in imperdiet et commodo vulputate,1911-07-05,0:13:29,EP
574,id justo sit amet sapien,1936-05-19,0:25:15,Single
674,rutrum rutrum neque aenean auctor gravida sem praesent,1938-03-12,0:01:15,EP
493,cubilia curae mauris viverra diam,2020-05-17,0:31:43,Album
99,penatibus et magnis dis parturient montes nascetur ridiculus,2007-06-26,0:11:33,Album
174,faucibus orci luctus et ultrices,1936-12-03,0:42:52,EP
853,ultrices posuere cubilia curae donec pharetra,1988-10-28,0:22:10,Single
254,neque aenean auctor gravida sem praesent id massa id nisl,1932-11-24,0:04:44,Album
68,non ligula pellentesque ultrices phasellus id sapien in,1952-07-04,0:04:48,Mixtape
134,nulla ac enim in tempor turpis,1956-07-16,0:34:34,EP
643,nulla ut erat id mauris vulputate elementum nullam varius nulla,1914-01-25,0:10:10,Album
189,felis donec semper sapien a libero nam dui proin leo,1920-04-13,0:06:47,Album
423,justo nec condimentum neque sapien placerat ante nulla,1996-08-20,0:25:36,Single
973,turpis adipiscing lorem vitae mattis nibh ligula nec sem,1929-08-03,0:11:32,EP
669,eget rutrum at lorem integer tincidunt ante vel ipsum praesent,1909-01-21,0:39:38,Single
749,blandit ultrices enim lorem ipsum,1978-06-19,0:31:06,Album
963,viverra pede ac diam cras pellentesque,1985-04-23,0:02:04,EP
703,posuere cubilia curae duis faucibus accumsan,1938-10-13,0:07:54,Single
174,sem praesent id massa id nisl venenatis lacinia aenean sit,1908-10-28,0:25:26,Compilation
283,adipiscing lorem vitae mattis nibh ligula nec sem duis aliquam,1936-04-20,0:28:43,Album
173,sit amet consectetuer adipiscing elit proin interdum mauris non,1958-06-11,0:40:37,Album
544,ipsum primis in faucibus orci luctus et ultrices posuere cubilia,1989-12-04,0:04:37,EP
424,posuere cubilia curae mauris viverra diam,1931-03-23,0:33:53,Single
309,aenean fermentum donec ut mauris eget massa tempor convallis,1915-02-08,0:09:33,Album
783,ante ipsum primis in faucibus orci,1932-07-05,0:53:59,Single
173,vivamus in felis eu sapien cursus vestibulum proin,1913-10-09,0:58:04,Compilation
414,odio odio elementum eu interdum eu,1923-02-24,0:35:06,Album
99,quis orci eget orci vehicula condimentum curabitur in libero ut,1922-05-18,0:41:50,Album
429,ante vel ipsum praesent blandit lacinia,1908-02-01,0:42:30,EP
634,luctus tincidunt nulla mollis molestie lorem quisque ut,1929-01-18,0:43:17,EP
378,ipsum primis in faucibus orci luctus et ultrices posuere cubilia,2003-01-30,0:08:45,Album
648,sapien iaculis congue vivamus metus arcu adipiscing molestie hendrerit at,2006-06-18,0:32:13,Mixtape
909,iaculis congue vivamus metus arcu,1937-11-13,0:03:13,EP
104,eu est congue elementum in hac habitasse,2018-06-30,0:04:53,Mixtape
174,sed ante vivamus tortor duis mattis egestas metus aenean,2013-09-10,0:31:39,Compilation
89,pretium quis lectus suspendisse potenti in eleifend quam a,1946-12-10,0:00:35,Album
484,morbi vel lectus in quam fringilla rhoncus mauris enim,1971-04-05,0:09:12,Mixtape
689,nam dui proin leo odio porttitor,1953-05-13,0:38:20,EP
129,pretium nisl ut volutpat sapien arcu sed,1986-03-26,0:34:18,Compilation
693,non mauris morbi non lectus aliquam sit,1920-01-28,0:29:05,Mixtape
879,ligula vehicula consequat morbi a ipsum integer,2011-01-25,0:30:18,Album
643,iaculis diam erat fermentum justo nec,1974-09-10,0:30:34,EP
988,molestie nibh in lectus pellentesque,1961-05-12,0:15:41,Compilation
129,at velit vivamus vel nulla eget,1942-02-01,0:57:57,EP
569,venenatis lacinia aenean sit amet justo morbi ut odio,1935-09-18,0:07:18,EP
39,lectus vestibulum quam sapien varius,1913-03-20,0:32:20,Mixtape
233,ante ipsum primis in faucibus orci luctus,2020-03-09,0:10:16,EP
549,sapien non mi integer ac neque duis,2009-05-15,0:45:23,Album
328,platea dictumst aliquam augue quam sollicitudin,1978-10-21,0:21:36,Mixtape
748,cursus urna ut tellus nulla,2004-08-25,0:54:00,Single
129,massa donec dapibus duis at velit,1966-09-06,0:36:19,Single
118,tincidunt nulla mollis molestie lorem quisque ut erat,1939-04-27,0:24:55,EP
73,quam suspendisse potenti nullam porttitor lacus at turpis donec posuere,1989-10-23,0:45:28,Album
198,sapien ut nunc vestibulum ante ipsum primis in faucibus orci,2008-01-01,0:20:13,Mixtape
319,nulla integer pede justo lacinia eget tincidunt eget,1913-09-25,0:42:44,EP
853,neque sapien placerat ante nulla justo,1921-05-19,0:48:14,Mixtape
678,curabitur convallis duis consequat dui,1965-06-09,0:38:04,EP
414,luctus et ultrices posuere cubilia curae nulla dapibus dolor vel,1966-08-14,0:41:57,Album
673,odio odio elementum eu interdum eu tincidunt in leo,1958-10-12,0:33:32,Single
799,lorem vitae mattis nibh ligula nec sem duis,1978-01-24,0:21:38,EP
509,amet justo morbi ut odio cras,1959-11-28,0:29:36,Mixtape
984,pretium iaculis justo in hac habitasse,1957-04-13,0:16:09,Mixtape
804,pede morbi porttitor lorem id,1942-05-23,0:27:55,Album
253,non lectus aliquam sit amet,1946-07-01,0:21:34,Single
984,est quam pharetra magna ac consequat metus sapien ut nunc,1906-01-23,0:26:07,Single
294,mattis egestas metus aenean fermentum donec ut,1995-08-05,0:54:08,EP
838,cursus vestibulum proin eu mi,1912-07-28,0:26:31,EP
79,eget semper rutrum nulla nunc purus phasellus in felis,1951-09-21,0:59:37,Mixtape
654,congue diam id ornare imperdiet sapien urna pretium nisl ut,2005-02-22,0:13:46,EP
739,sit amet justo morbi ut odio,1939-10-18,0:48:16,Compilation
673,vestibulum eget vulputate ut ultrices vel,1984-09-28,0:28:00,Compilation
53,porttitor lorem id ligula suspendisse ornare consequat lectus,1914-08-27,0:15:52,Single
634,scelerisque mauris sit amet eros suspendisse accumsan,1900-08-03,0:21:18,EP
569,maecenas leo odio condimentum id,1996-02-25,0:54:27,EP
769,feugiat et eros vestibulum ac est lacinia nisi venenatis tristique,1950-02-06,0:24:02,Compilation
648,nec condimentum neque sapien placerat,2000-08-06,0:37:40,Compilation
198,lacinia sapien quis libero nullam sit amet turpis,2001-01-22,0:15:01,Single
193,lacus curabitur at ipsum ac tellus,2015-01-15,0:28:14,Single
224,nibh quisque id justo sit amet sapien dignissim vestibulum,1950-06-14,0:53:58,Album
198,accumsan odio curabitur convallis duis consequat dui nec nisi,1998-06-05,0:17:51,Mixtape
338,dolor vel est donec odio justo sollicitudin ut suscipit a,2000-12-30,0:07:15,Mixtape
509,ipsum dolor sit amet consectetuer adipiscing elit proin interdum,2015-06-25,0:20:25,Compilation
354,pretium iaculis diam erat fermentum justo nec condimentum,1936-05-12,0:05:33,Compilation
283,vestibulum ante ipsum primis in faucibus orci,1957-08-17,0:20:38,Album
449,dapibus dolor vel est donec,1923-03-25,0:39:55,Compilation
833,posuere metus vitae ipsum aliquam non mauris morbi non,1980-05-11,0:03:42,Single
653,vitae consectetuer eget rutrum at,2019-03-28,0:27:04,Mixtape
743,sodales scelerisque mauris sit amet eros suspendisse,1920-03-09,0:24:59,Mixtape
649,turpis adipiscing lorem vitae mattis nibh ligula,2016-02-23,0:18:33,Album
169,ligula vehicula consequat morbi a ipsum integer a nibh in,1977-12-27,0:09:10,Mixtape
258,eu massa donec dapibus duis at velit eu est congue,1906-12-02,0:52:19,Compilation
918,vestibulum velit id pretium iaculis diam erat fermentum,1966-06-20,0:38:48,EP
478,dui proin leo odio porttitor id consequat,1999-09-02,0:39:43,Single
64,euismod scelerisque quam turpis adipiscing lorem vitae mattis,1981-10-05,0:27:24,Single
728,a libero nam dui proin leo odio,1914-12-23,0:40:03,Compilation
954,sapien cursus vestibulum proin eu mi nulla ac enim in,1917-04-06,0:58:13,Mixtape
459,est lacinia nisi venenatis tristique fusce,2009-01-08,0:38:38,Single
669,rutrum rutrum neque aenean auctor,1946-07-01,0:08:35,Album
624,in congue etiam justo etiam,2012-10-16,0:32:30,Single
794,lectus in quam fringilla rhoncus mauris enim leo,1957-10-15,0:19:09,Mixtape
788,consectetuer adipiscing elit proin risus,1945-01-16,0:28:49,Album
858,lorem ipsum dolor sit amet,1980-05-20,0:23:10,Album
68,in faucibus orci luctus et ultrices posuere cubilia curae,1948-07-11,0:28:37,Mixtape
954,iaculis diam erat fermentum justo nec condimentum,1922-10-01,0:58:51,Mixtape
473,id luctus nec molestie sed,1947-05-17,0:18:36,Mixtape
329,eget elit sodales scelerisque mauris sit amet eros suspendisse,2007-07-06,0:23:01,Mixtape
499,augue vestibulum ante ipsum primis in,1930-11-18,0:50:38,EP
448,ut ultrices vel augue vestibulum ante ipsum primis in,2022-10-31,0:04:33,Compilation
23,ante vestibulum ante ipsum primis in faucibus orci luctus et,2019-03-21,0:20:04,Single
849,suspendisse potenti cras in purus eu magna vulputate luctus,1985-07-02,0:21:59,EP
743,morbi a ipsum integer a,1981-02-28,0:09:41,Album
418,aenean sit amet justo morbi ut,1986-10-17,0:05:48,Album
559,posuere cubilia curae mauris viverra diam vitae,2022-03-29,0:23:00,Compilation
234,ut at dolor quis odio,1959-01-02,0:22:54,Single
979,faucibus orci luctus et ultrices posuere cubilia curae nulla dapibus,1990-10-23,0:04:35,Mixtape
329,quisque id justo sit amet sapien dignissim vestibulum,1974-12-06,0:46:48,Compilation
993,amet eros suspendisse accumsan tortor quis turpis sed ante,1901-11-19,0:10:22,EP
258,eu nibh quisque id justo sit amet sapien,1927-08-08,0:58:35,Compilation
468,justo etiam pretium iaculis justo in hac habitasse,1915-04-24,0:32:15,Album
949,ullamcorper augue a suscipit nulla elit ac,1919-08-13,0:28:29,EP
218,sapien in sapien iaculis congue,1954-09-17,0:47:33,Mixtape
754,integer non velit donec diam neque vestibulum eget vulputate ut,1925-07-13,0:38:47,EP
969,adipiscing lorem vitae mattis nibh ligula nec,2014-06-09,0:33:22,Mixtape
953,nulla pede ullamcorper augue a suscipit nulla elit ac nulla,1944-06-01,0:32:39,Album
789,justo pellentesque viverra pede ac diam cras pellentesque volutpat dui,2002-11-24,0:38:23,Album
914,non lectus aliquam sit amet diam,2016-12-25,0:33:13,Mixtape
104,amet nunc viverra dapibus nulla,1989-05-05,0:46:47,Compilation
908,lectus in quam fringilla rhoncus,2003-07-15,0:05:23,Compilation
639,at velit vivamus vel nulla,1996-01-28,0:19:06,Single
568,potenti nullam porttitor lacus at turpis donec posuere metus,1912-11-08,0:53:59,Mixtape
383,aliquam non mauris morbi non lectus aliquam sit amet diam,2006-08-11,0:20:59,Compilation
64,at nulla suspendisse potenti cras,1974-01-26,0:40:19,Single
778,pede justo eu massa donec dapibus duis,1947-11-29,0:02:42,Mixtape
409,habitasse platea dictumst etiam faucibus cursus urna ut tellus nulla,2017-01-14,0:19:47,Mixtape
619,convallis nulla neque libero convallis eget eleifend luctus ultricies,1966-10-29,0:36:28,Compilation
34,ligula suspendisse ornare consequat lectus in est risus,2003-10-13,0:38:35,Mixtape
358,sapien placerat ante nulla justo aliquam quis,1965-09-11,0:04:42,Mixtape
768,erat id mauris vulputate elementum,1938-07-24,0:54:15,EP
599,luctus et ultrices posuere cubilia curae nulla,2014-11-24,0:26:12,Album
448,etiam justo etiam pretium iaculis,1940-08-02,0:29:15,EP
923,tempor convallis nulla neque libero convallis eget,1978-09-22,0:35:40,Compilation
158,quam nec dui luctus rutrum nulla tellus in sagittis dui,1925-06-30,0:13:02,Mixtape
108,pellentesque at nulla suspendisse potenti cras,1984-03-19,0:48:18,EP
419,pellentesque at nulla suspendisse potenti cras in purus eu,1948-08-28,0:01:32,Compilation
539,bibendum felis sed interdum venenatis,1937-06-09,0:42:57,Single
628,ultrices aliquet maecenas leo odio condimentum,1975-08-11,0:13:01,Compilation
474,posuere cubilia curae nulla dapibus,1939-09-22,0:36:30,Album
394,vel nulla eget eros elementum,1989-01-24,0:59:46,Album
558,accumsan odio curabitur convallis duis consequat dui nec nisi volutpat,1960-12-07,0:56:09,Compilation
603,vivamus vestibulum sagittis sapien cum sociis natoque,1913-06-23,0:22:59,Mixtape
778,in quam fringilla rhoncus mauris enim leo rhoncus sed vestibulum,1953-03-12,0:44:09,Compilation
179,mauris non ligula pellentesque ultrices phasellus id sapien in sapien,1949-07-24,0:59:25,EP
269,semper est quam pharetra magna ac consequat metus sapien,1990-01-28,0:14:14,Album
884,rutrum ac lobortis vel dapibus at diam nam tristique,1968-11-21,0:58:43,Mixtape
138,platea dictumst etiam faucibus cursus urna ut,1931-02-27,0:06:39,Album
963,vel est donec odio justo sollicitudin ut suscipit,1963-02-16,0:21:17,Compilation
439,aliquet at feugiat non pretium quis,1987-08-23,0:07:47,Album
599,pede ac diam cras pellentesque volutpat dui maecenas,1983-07-27,0:10:53,Compilation
578,placerat praesent blandit nam nulla integer pede,1981-04-23,0:33:34,Compilation
699,duis mattis egestas metus aenean fermentum,1976-02-22,0:40:55,Mixtape
623,fusce posuere felis sed lacus,1913-11-28,0:58:45,Single
349,blandit nam nulla integer pede,1927-03-21,0:56:42,Compilation
544,quam nec dui luctus rutrum nulla tellus in,1954-07-27,0:46:32,Single
123,fusce lacus purus aliquet at feugiat,1991-01-02,0:03:47,Single
108,nisi venenatis tristique fusce congue diam,1963-06-16,0:56:52,Album
524,montes nascetur ridiculus mus vivamus vestibulum sagittis sapien cum sociis,1993-04-03,0:10:36,Compilation
29,ut volutpat sapien arcu sed augue aliquam erat volutpat,2018-03-16,0:55:53,Mixtape
824,sollicitudin ut suscipit a feugiat et,1928-09-15,0:04:16,Single
593,nec nisi vulputate nonummy maecenas,1937-04-17,0:33:24,Single
348,fringilla rhoncus mauris enim leo rhoncus sed vestibulum sit amet,1928-07-31,0:51:08,EP
854,mauris viverra diam vitae quam suspendisse,1955-12-11,0:41:04,Mixtape
653,mauris eget massa tempor convallis,1908-02-15,0:11:41,Album
328,ipsum dolor sit amet consectetuer adipiscing elit proin interdum,1940-11-03,0:01:41,Single
304,posuere cubilia curae nulla dapibus dolor,1911-03-30,0:01:39,Album
573,consectetuer eget rutrum at lorem integer tincidunt ante vel,1929-11-24,0:26:36,Mixtape
323,donec ut mauris eget massa tempor,1958-05-23,0:31:00,Mixtape
779,non interdum in ante vestibulum ante ipsum,1975-12-15,0:44:25,Album
839,nullam porttitor lacus at turpis,1995-06-28,0:13:38,Compilation
474,aliquam augue quam sollicitudin vitae consectetuer eget rutrum,1919-02-26,0:18:26,Compilation
983,venenatis lacinia aenean sit amet,1934-09-25,0:19:36,EP
578,id ornare imperdiet sapien urna pretium,1976-01-22,0:18:45,Album
744,nunc commodo placerat praesent blandit,1912-12-02,0:30:33,Single
19,donec pharetra magna vestibulum aliquet ultrices erat tortor sollicitudin mi,1978-04-06,0:14:12,Single
703,tempor turpis nec euismod scelerisque quam turpis adipiscing,1999-07-16,0:04:19,EP
184,interdum eu tincidunt in leo maecenas pulvinar lobortis est phasellus,2005-02-01,0:08:56,Single
504,porta volutpat erat quisque erat eros,2019-01-01,0:11:01,Single
904,justo aliquam quis turpis eget elit sodales scelerisque mauris sit,2020-01-26,0:44:12,Album
443,eget nunc donec quis orci,1967-09-04,0:51:11,Single
508,ornare imperdiet sapien urna pretium nisl,1919-12-14,0:02:12,EP
169,suscipit a feugiat et eros vestibulum ac est lacinia,1952-11-13,0:02:31,Album
859,turpis sed ante vivamus tortor duis,1915-02-15,0:38:16,Mixtape
333,sed interdum venenatis turpis enim blandit,1987-04-07,0:47:22,Mixtape
259,in faucibus orci luctus et ultrices posuere cubilia,1902-01-13,0:07:13,Album
663,phasellus sit amet erat nulla,2021-04-23,0:57:09,Compilation
104,non mattis pulvinar nulla pede,1964-10-28,0:51:06,Album
388,vestibulum sit amet cursus id turpis,2015-05-24,0:04:22,Single
488,lectus pellentesque eget nunc donec quis orci eget orci,1993-05-30,0:24:35,Mixtape
199,at feugiat non pretium quis lectus suspendisse potenti in eleifend,1951-09-06,0:10:24,EP
213,rutrum neque aenean auctor gravida sem,1978-09-19,0:18:20,Single
733,ipsum primis in faucibus orci luctus,1969-09-08,0:16:23,Mixtape
39,nisl ut volutpat sapien arcu sed,1902-03-07,0:04:07,Mixtape
689,vulputate ut ultrices vel augue vestibulum ante ipsum primis,1942-11-14,0:38:08,Compilation
519,et eros vestibulum ac est lacinia nisi,2011-10-19,0:21:13,Single
958,lectus vestibulum quam sapien varius ut blandit,1977-11-22,0:24:54,Single
559,elementum nullam varius nulla facilisi cras non velit,1971-07-06,0:42:26,Single
273,pede justo lacinia eget tincidunt eget tempus vel pede,2014-11-09,0:41:34,EP
509,eu est congue elementum in hac habitasse platea dictumst,1998-02-20,0:43:18,Album
858,metus aenean fermentum donec ut mauris eget massa tempor convallis,2004-09-24,0:10:00,EP
558,primis in faucibus orci luctus et ultrices posuere cubilia,1988-06-11,0:48:36,Mixtape
178,phasellus id sapien in sapien iaculis congue vivamus,1913-01-01,0:47:49,Single
404,lorem ipsum dolor sit amet consectetuer adipiscing elit proin interdum,1963-12-06,0:31:07,Mixtape
234,volutpat sapien arcu sed augue aliquam erat volutpat in congue,1916-03-23,0:18:12,Album
169,eget nunc donec quis orci eget,1970-05-20,0:31:30,Album
234,pharetra magna vestibulum aliquet ultrices erat tortor sollicitudin mi sit,1918-09-27,0:45:26,Album
274,amet consectetuer adipiscing elit proin interdum,1973-09-02,0:00:43,Album
419,lacinia erat vestibulum sed magna at nunc,1971-04-12,0:26:33,Single
648,turpis eget elit sodales scelerisque mauris,1946-04-02,0:22:13,Mixtape
249,eget semper rutrum nulla nunc purus phasellus in felis,1953-08-08,0:20:07,Mixtape
649,condimentum curabitur in libero ut,2014-08-18,0:05:34,Compilation
784,est congue elementum in hac habitasse platea dictumst morbi vestibulum,2010-08-03,0:16:53,EP
964,venenatis tristique fusce congue diam id ornare imperdiet sapien urna,1902-06-01,0:51:31,Album
753,aenean fermentum donec ut mauris,1935-05-01,0:19:45,Compilation
494,vel pede morbi porttitor lorem id ligula suspendisse ornare,1986-12-13,0:24:37,Single
258,maecenas tristique est et tempus semper,1940-09-23,0:22:11,Compilation
763,nulla suscipit ligula in lacus curabitur at,2018-12-11,0:18:21,Single
23,convallis tortor risus dapibus augue vel,1979-01-31,0:27:46,Compilation
453,vulputate luctus cum sociis natoque penatibus et magnis dis,1948-09-15,0:29:09,Compilation
979,nonummy integer non velit donec diam neque,1902-01-29,0:41:34,EP
273,ac diam cras pellentesque volutpat,2015-05-01,0:08:17,Single
494,fermentum donec ut mauris eget,1925-08-20,0:48:49,Mixtape
83,sed ante vivamus tortor duis mattis egestas,1904-12-06,0:12:36,EP
534,quis odio consequat varius integer ac leo pellentesque ultrices mattis,1988-02-23,0:26:05,Single
49,blandit non interdum in ante vestibulum,1922-11-27,0:25:30,Single
108,sit amet eleifend pede libero quis,1973-09-22,0:52:39,EP
929,posuere cubilia curae duis faucibus accumsan odio curabitur,1954-01-11,0:33:34,Single
28,quisque arcu libero rutrum ac lobortis vel,1906-04-18,0:16:39,EP
828,ligula vehicula consequat morbi a ipsum,1903-03-06,0:37:43,EP
749,semper est quam pharetra magna ac consequat metus sapien,1904-01-17,0:29:01,Single
319,dui nec nisi volutpat eleifend donec ut dolor morbi,1901-11-18,0:35:41,Compilation
89,nulla sed accumsan felis ut at dolor,1984-10-12,0:58:21,EP
568,sit amet eleifend pede libero quis orci nullam molestie,1937-05-03,0:27:30,EP
903,est lacinia nisi venenatis tristique,2004-01-09,0:42:02,Album
898,quis turpis eget elit sodales scelerisque mauris sit amet,2018-08-14,0:12:11,EP
604,sed augue aliquam erat volutpat in congue,1933-02-23,0:16:03,Mixtape
314,pede justo eu massa donec dapibus duis at velit eu,1926-10-31,0:54:11,EP
58,convallis nulla neque libero convallis eget,1905-08-07,0:19:41,Album
929,convallis morbi odio odio elementum eu interdum eu,1938-05-31,0:38:46,Album
3,in purus eu magna vulputate luctus,1949-05-26,0:34:46,Mixtape
628,est donec odio justo sollicitudin ut suscipit a feugiat,2004-05-27,0:01:17,Single
174,adipiscing elit proin risus praesent lectus vestibulum quam,1956-12-26,0:27:39,EP
179,eros vestibulum ac est lacinia,1907-08-09,0:55:25,Mixtape
138,elementum ligula vehicula consequat morbi a ipsum integer a,1960-01-03,0:27:21,EP
384,felis sed lacus morbi sem mauris laoreet ut rhoncus aliquet,1946-04-02,0:34:24,EP
249,pellentesque eget nunc donec quis orci eget orci,2021-04-08,0:40:16,Single
604,aenean lectus pellentesque eget nunc donec,1964-05-13,0:35:04,Compilation
288,et tempus semper est quam pharetra magna ac,1988-11-06,0:37:08,Mixtape
779,curabitur at ipsum ac tellus semper interdum,2016-11-13,0:09:22,Album
174,ultrices enim lorem ipsum dolor sit amet consectetuer,1935-03-22,0:31:33,Compilation
419,faucibus cursus urna ut tellus nulla ut erat id,1920-10-03,0:08:43,Single
119,ut blandit non interdum in ante vestibulum ante ipsum,1950-02-27,0:48:04,EP
858,odio elementum eu interdum eu tincidunt in leo,1986-05-30,0:37:08,Album
714,integer ac leo pellentesque ultrices,1951-04-08,0:26:02,Mixtape
613,ut volutpat sapien arcu sed augue aliquam,1921-07-15,0:10:28,Mixtape
304,lacus curabitur at ipsum ac tellus semper interdum mauris ullamcorper,1950-09-21,0:24:15,Mixtape
414,mauris enim leo rhoncus sed vestibulum,1997-04-05,0:37:15,Compilation
